[
  {
    "relation_id": "REL-76ba2684",
    "kind": "validated_by",
    "src": {
      "type": "finding",
      "id": "F-df01bb454ed5"
    },
    "dst": {
      "type": "exec",
      "id": "EXEC-a9b19962f6"
    },
    "support": {
      "evidence_id": "EV-ecffa30c"
    },
    "actor": null,
    "note": "E4 foundry-test evidence",
    "created_at": "2026-09-09T12:00:41.000000+00:00"
  },
  {
    "relation_id": "REL-f2e7264b",
    "kind": "observed_in",
    "src": {
      "type": "finding",
      "id": "F-df01bb454ed5"
    },
    "dst": {
      "type": "snapshot",
      "id": "unpinned"
    },
    "support": {
      "pin": "source"
    },
    "actor": null,
    "note": null,
    "created_at": "2026-09-09T12:00:41.000000+00:00"
  },
  {
    "relation_id": "REL-e0090dc7",
    "kind": "disproved_by",
    "src": {
      "type": "finding",
      "id": "F-df01bb454ed5"
    },
    "dst": {
      "type": "memory",
      "id": "MEM-3f00249e"
    },
    "support": {
      "memory_id": "MEM-3f00249e",
      "status": "DISPROVED"
    },
    "actor": null,
    "note": "the removed timelock precondition is enforced by the guard",
    "created_at": "2026-09-09T12:00:41.000000+00:00"
  },
  {
    "relation_id": "REL-d5596ac2",
    "kind": "observed_in",
    "src": {
      "type": "finding",
      "id": "F-ee0311c3397a"
    },
    "dst": {
      "type": "snapshot",
      "id": "unpinned"
    },
    "support": {
      "pin": "source"
    },
    "actor": null,
    "note": null,
    "created_at": "2026-09-09T12:00:41.000000+00:00"
  }
]
